{
  "schemaVersion": 1,
  "id": "nativeGlass.ocean",
  "name": "Native Glass · Ocean",
  "family": "nativeGlass",
  "palette": {
    "name": "Ocean",
    "colors": {
      "background": "#031925",
      "surface": "#073348",
      "primaryText": "#E8FBFF",
      "mutedText": "#81ADBB",
      "accent": "#37D9ED",
      "working": "#57A9FF",
      "waitingApproval": "#FFD166",
      "waitingInput": "#F4A8FF",
      "compacting": "#9E9BFF",
      "completed": "#4DE3A1",
      "failed": "#FF6B7A",
      "interrupted": "#FF9D76",
      "idle": "#81ADBB"
    }
  },
  "typography": {
    "family": "SF Pro Rounded",
    "sizeScale": 1,
    "weight": "medium",
    "lineHeight": 1.2
  },
  "cornerRadius": 24,
  "border": {
    "color": "#37D9ED",
    "width": 1,
    "style": "solid"
  },
  "shadow": {
    "color": "#011017",
    "x": 0,
    "y": 12,
    "blur": 30,
    "opacity": 0.3
  },
  "noise": 0.03,
  "blur": "regular",
  "collapsedOpacity": 0.72,
  "expandedOpacity": 0.88,
  "animation": {
    "enabled": true,
    "durationMs": 180,
    "easing": "easeOut"
  }
}
