{
  "schemaVersion": 1,
  "id": "minimalOLED.ocean",
  "name": "Minimal OLED · Ocean",
  "family": "minimalOLED",
  "palette": {
    "name": "Ocean",
    "colors": {
      "background": "#031925",
      "surface": "#073348",
      "primaryText": "#E8FBFF",
      "mutedText": "#81ADBB",
      "accent": "#37D9ED",
      "working": "#57A9FF",
      "waitingApproval": "#FFD166",
      "waitingInput": "#F4A8FF",
      "compacting": "#9E9BFF",
      "completed": "#4DE3A1",
      "failed": "#FF6B7A",
      "interrupted": "#FF9D76",
      "idle": "#81ADBB"
    }
  },
  "typography": {
    "family": "SF Pro Text",
    "sizeScale": 1,
    "weight": "regular",
    "lineHeight": 1.2
  },
  "cornerRadius": 18,
  "border": {
    "color": "#37D9ED",
    "width": 0,
    "style": "none"
  },
  "shadow": {
    "color": "#011017",
    "x": 0,
    "y": 0,
    "blur": 0,
    "opacity": 0
  },
  "noise": 0,
  "blur": "off",
  "collapsedOpacity": 1,
  "expandedOpacity": 1,
  "animation": {
    "enabled": true,
    "durationMs": 140,
    "easing": "easeInOut"
  }
}
